{
  "dbt": {
    "failures": 0,
    "finished_at": "2026-10-04T20:46:36Z",
    "models_ok": 4,
    "status": "success",
    "tests_ok": 24
  },
  "generated_at": "2026-10-04T02:46:00Z",
  "schema_version": 1,
  "snapshots": {
    "alerts": 5,
    "bot_share_hourly": 1,
    "digest": 3,
    "edits_per_min": 15,
    "page_activity": 2
  }
}
